{"ActiveName":null,"Authority":{"ControllerMatch":null,"HomeAuthorityKeyLabel":"0123456789ab...","IntendedRoot":{"FilesystemCapabilityStatus":"UNPROBED","RequestedInitialRootContextHash":"3333333333333333333333333333333333333333333333333333333333333333","Selection":"known-folder-default"},"Legacy":{"Drift":"none","EnvName":null,"Gap":"none","HomeRootMatches":false,"LiveParity":{"Mismatches":[],"Status":"not-checked"},"OldLockStatus":"MISSING","Schema":null,"Status":"MISSING"},"LiveRoots":{"Platforms":[{"ManagedCount":3,"Platform":"Claude","Status":"EXISTS"},{"ManagedCount":2,"Platform":"Codex","Status":"EXISTS"},{"ManagedCount":0,"Platform":"Reasonix","Status":"MISSING"}],"Pristine":false},"LockParity":{"Mismatches":[],"Reasons":["state-not-valid"],"Status":"not-checked"},"NextOperation":"env authority adopt <name> -DryRun -PlanPath <external-plan.json>","PairStatus":"MISSING","RecoveryStatus":"clean","RootClaimsStatus":"MISSING","Route":"adopt","StateStatus":"MISSING","StateSummary":null,"SystemStatus":"present-marker","UnfinishedTransactionIds":[]},"Environments":[{"Active":false,"ClaudeSkillCount":3,"CodexSkillCount":2,"Description":"fixture environment","Name":"work","Profile":"coding","ReasonixSkillCount":1,"Status":"ok","StatusDetail":null}],"GeneratedAtUtc":"2026-09-13T00:00:00.0000000Z","Result":"PASS","SchemaVersion":2}